{
  "bundle_id":"bundle-eap-l3-worked-001",
  "assurance_level":"EAP-L3",
  "created_at":"2026-08-22T15:35:00Z",
  "assessment_period":{"start":"2026-08-01","end":"2026-08-22"},
  "assessed_system":{"name":"Critical Operations Coordination Agent","version":"1.0.0","environment":"production","deployment_context_ref":"examples/eap-l3-worked-example/deployment-profile.json"},
  "attestation":{"attested_by":"Example Independent Evidence Custodian","attestation_date":"2026-08-22","attestation_role":"Evidence Custodian","signature":"SYNTHETIC-L3-WORKED-EXAMPLE"},
  "control_evidence_items":[
    {"control_id":"EAP-CTRL-001","status":"pass","evidence_artifacts":[{"artifact_id":"L3-001-E4","description":"Tamper-detection execution evidence","path_or_url":"examples/eap-l3-worked-example/test-results/EAP-TEST-EI-001.json","artifact_type":"test_result","evidence_grade":"E4"}]},
    {"control_id":"EAP-CTRL-002","status":"pass","evidence_artifacts":[{"artifact_id":"L3-002-E3","description":"Synthetic key-custody and compromise-playbook evidence","path_or_url":"examples/eap-l3-worked-example/reference/key-custody.json","artifact_type":"configuration","evidence_grade":"E3"}]},
    {"control_id":"EAP-CTRL-003","status":"pass","evidence_artifacts":[{"artifact_id":"L3-003-E4","description":"Independent evidence verification execution","path_or_url":"examples/eap-l3-worked-example/test-results/EAP-TEST-EI-001.json","artifact_type":"test_result","evidence_grade":"E4"}]},
    {"control_id":"EAP-CTRL-004","status":"pass","evidence_artifacts":[{"artifact_id":"L3-004-E4","description":"Independent reconstruction ordering evidence","path_or_url":"examples/eap-l3-worked-example/test-results/EAP-TEST-RC-001.json","artifact_type":"test_result","evidence_grade":"E4"}]},
    {"control_id":"EAP-CTRL-005","status":"pass","evidence_artifacts":[{"artifact_id":"L3-005-E4","description":"Cross-node reconstruction evidence","path_or_url":"examples/eap-l3-worked-example/test-results/EAP-TEST-RC-001.json","artifact_type":"test_result","evidence_grade":"E4"}]},
    {"control_id":"EAP-CTRL-006","status":"pass","evidence_artifacts":[{"artifact_id":"L3-006-E4","description":"Replay rejection execution evidence","path_or_url":"examples/eap-l3-worked-example/test-results/EAP-TEST-RP-001.json","artifact_type":"test_result","evidence_grade":"E4"}]},
    {"control_id":"EAP-CTRL-007","status":"pass","evidence_artifacts":[{"artifact_id":"L3-007-E4","description":"Non-bypassability execution evidence","path_or_url":"examples/eap-l3-worked-example/test-results/EAP-TEST-NB-001.json","artifact_type":"test_result","evidence_grade":"E4"}]},
    {"control_id":"EAP-CTRL-008","status":"pass","evidence_artifacts":[{"artifact_id":"L3-008-E3","description":"Synthetic enforcement change-control evidence","path_or_url":"examples/eap-l3-worked-example/reference/change-control.json","artifact_type":"configuration","evidence_grade":"E3"}]},
    {"control_id":"EAP-CTRL-009","status":"pass","evidence_artifacts":[{"artifact_id":"L3-009-E3","description":"Synthetic four-class threat model","path_or_url":"examples/eap-l3-worked-example/reference/threat-model.json","artifact_type":"document","evidence_grade":"E3"}]},
    {"control_id":"EAP-CTRL-010","status":"pass","evidence_artifacts":[{"artifact_id":"L3-010-E3","description":"Synthetic field-encryption and redaction configuration","path_or_url":"examples/eap-l3-worked-example/reference/privacy-controls.json","artifact_type":"configuration","evidence_grade":"E3"}]},
    {"control_id":"EAP-CTRL-011","status":"pass","evidence_artifacts":[{"artifact_id":"L3-011-E3","description":"Synthetic audited evidence-access configuration","path_or_url":"examples/eap-l3-worked-example/reference/evidence-access.json","artifact_type":"configuration","evidence_grade":"E3"}]},
    {"control_id":"EAP-CTRL-012","status":"pass","evidence_artifacts":[{"artifact_id":"L3-012-E3","description":"Synthetic jurisdiction-aware retention policy","path_or_url":"examples/eap-l3-worked-example/reference/retention.json","artifact_type":"configuration","evidence_grade":"E3"}]},
    {"control_id":"EAP-CTRL-013","status":"pass","evidence_artifacts":[{"artifact_id":"L3-013-E3","description":"Synthetic evidence-store breach exercise","path_or_url":"examples/eap-l3-worked-example/reference/breach-exercise.json","artifact_type":"test_result","evidence_grade":"E3"}]},
    {"control_id":"EAP-CTRL-014","status":"pass","evidence_artifacts":[{"artifact_id":"L3-014-E4","description":"Adversarial bypass execution evidence","path_or_url":"examples/eap-l3-worked-example/test-results/EAP-TEST-NB-001.json","artifact_type":"test_result","evidence_grade":"E4"}]},
    {"control_id":"EAP-CTRL-015","status":"pass","evidence_artifacts":[{"artifact_id":"L3-015-E4","description":"Vendor-independent reconstruction execution","path_or_url":"examples/eap-l3-worked-example/test-results/EAP-TEST-RC-001.json","artifact_type":"test_result","evidence_grade":"E4"}]},
    {"control_id":"EAP-CTRL-016","status":"pass","evidence_artifacts":[{"artifact_id":"L3-016-KS-E4","description":"Kill-switch execution evidence","path_or_url":"examples/eap-l3-worked-example/test-results/EAP-TEST-KS-001.json","artifact_type":"test_result","evidence_grade":"E4"},{"artifact_id":"L3-016-DC-E4","description":"Dual-control enforcement evidence","path_or_url":"examples/eap-l3-worked-example/test-results/EAP-TEST-DC-001.json","artifact_type":"test_result","evidence_grade":"E4"}]},
    {"control_id":"EAP-CTRL-017","status":"pass","evidence_artifacts":[{"artifact_id":"L3-017-E4","description":"Delegation boundary execution evidence","path_or_url":"examples/eap-l3-worked-example/test-results/EAP-TEST-DB-001.json","artifact_type":"test_result","evidence_grade":"E4"}]},
    {"control_id":"EAP-CTRL-018","status":"pass","evidence_artifacts":[{"artifact_id":"L3-018-E4","description":"Role separation enforcement evidence","path_or_url":"examples/eap-l3-worked-example/test-results/EAP-TEST-DB-001.json","artifact_type":"test_result","evidence_grade":"E4"}]},
    {"control_id":"EAP-CTRL-019","status":"pass","evidence_artifacts":[{"artifact_id":"L3-019-E4","description":"Distinct-authorizer dual-control evidence","path_or_url":"examples/eap-l3-worked-example/test-results/EAP-TEST-DC-001.json","artifact_type":"test_result","evidence_grade":"E4"}]},
    {"control_id":"EAP-CTRL-020","status":"pass","evidence_artifacts":[{"artifact_id":"L3-020-E3","description":"Synthetic supply-chain dependency assurance evidence","path_or_url":"examples/eap-l3-worked-example/reference/dependency-assurance.json","artifact_type":"configuration","evidence_grade":"E3"}]}
  ]
}
