{"$schema":"../../schemas/evidence-bundle.schema.json","bundle_id":"bundle-eap-l2-worked-001","assurance_level":"EAP-L2","created_at":"2026-08-22T15:10:00Z","assessment_period":{"start":"2026-08-01","end":"2026-08-22"},"assessed_system":{"name":"Controlled Purchasing Agent","version":"1.0.0","environment":"production","deployment_context_ref":"examples/eap-l2-worked-example/deployment-profile.json"},"attestation":{"attested_by":"Example Evidence Custodian","attestation_date":"2026-08-22","attestation_role":"Evidence Custodian","signature":"SYNTHETIC-WORKED-EXAMPLE"},"control_evidence_items":[{"control_id":"EAP-CTRL-001","status":"pass","notes":"Synthetic worked-example evidence demonstrates the L2 control obligation and is validated as reference evidence only.","evidence_artifacts":[{"artifact_id":"L2-EAP-CTRL-001-E1","description":"Reference evidence for EAP-CTRL-001 in the EAP-L2 worked example","path_or_url":"examples/eap-l2-worked-example/artifacts/eap-ctrl-001-evidence.json","artifact_type":"configuration","evidence_grade":"E3"}]},{"control_id":"EAP-CTRL-002","status":"pass","notes":"Synthetic worked-example evidence demonstrates the L2 control obligation and is validated as reference evidence only.","evidence_artifacts":[{"artifact_id":"L2-EAP-CTRL-002-E1","description":"Reference evidence for EAP-CTRL-002 in the EAP-L2 worked example","path_or_url":"examples/eap-l2-worked-example/artifacts/eap-ctrl-002-evidence.json","artifact_type":"configuration","evidence_grade":"E3"}]},{"control_id":"EAP-CTRL-003","status":"pass","notes":"Synthetic worked-example evidence demonstrates the L2 control obligation and is validated as reference evidence only.","evidence_artifacts":[{"artifact_id":"L2-EAP-CTRL-003-E1","description":"Reference evidence for EAP-CTRL-003 in the EAP-L2 worked example","path_or_url":"examples/eap-l2-worked-example/artifacts/eap-ctrl-003-evidence.json","artifact_type":"configuration","evidence_grade":"E3"}]},{"control_id":"EAP-CTRL-004","status":"pass","notes":"Synthetic worked-example evidence demonstrates the L2 control obligation and is validated as reference evidence only.","evidence_artifacts":[{"artifact_id":"L2-EAP-CTRL-004-E1","description":"Reference evidence for EAP-CTRL-004 in the EAP-L2 worked example","path_or_url":"examples/eap-l2-worked-example/artifacts/eap-ctrl-004-evidence.json","artifact_type":"configuration","evidence_grade":"E3"}]},{"control_id":"EAP-CTRL-005","status":"pass","notes":"Synthetic worked-example evidence demonstrates the L2 control obligation and is validated as reference evidence only.","evidence_artifacts":[{"artifact_id":"L2-EAP-CTRL-005-E1","description":"Reference evidence for EAP-CTRL-005 in the EAP-L2 worked example","path_or_url":"examples/eap-l2-worked-example/artifacts/eap-ctrl-005-evidence.json","artifact_type":"configuration","evidence_grade":"E3"}]},{"control_id":"EAP-CTRL-006","status":"pass","notes":"Synthetic worked-example evidence demonstrates the L2 SHOULD control and is included to demonstrate replay resistance evidence.","evidence_artifacts":[{"artifact_id":"L2-EAP-CTRL-006-E1","description":"Reference evidence for EAP-CTRL-006 in the EAP-L2 worked example","path_or_url":"examples/eap-l2-worked-example/artifacts/eap-ctrl-006-evidence.json","artifact_type":"test_result","evidence_grade":"E3"}]},{"control_id":"EAP-CTRL-007","status":"pass","notes":"Controlled invocation surface is exercised by EAP-TEST-NB-001.","evidence_artifacts":[{"artifact_id":"L2-EAP-CTRL-007-E1","description":"Non-bypassability executable test result","path_or_url":"examples/eap-l2-worked-example/test-results/EAP-TEST-NB-001.json","artifact_type":"test_result","evidence_grade":"E4"}]},{"control_id":"EAP-CTRL-008","status":"pass","notes":"Synthetic change-control evidence for enforcement configuration.","evidence_artifacts":[{"artifact_id":"L2-EAP-CTRL-008-E1","description":"Reference evidence for EAP-CTRL-008 in the EAP-L2 worked example","path_or_url":"examples/eap-l2-worked-example/artifacts/eap-ctrl-008-evidence.json","artifact_type":"configuration","evidence_grade":"E3"}]},{"control_id":"EAP-CTRL-009","status":"not_applicable","notes":"Not applicable at EAP-L2 according to the canonical overlay.","evidence_artifacts":[]},{"control_id":"EAP-CTRL-010","status":"pass","notes":"Synthetic field-level protection evidence.","evidence_artifacts":[{"artifact_id":"L2-EAP-CTRL-010-E1","description":"Reference evidence for EAP-CTRL-010 in the EAP-L2 worked example","path_or_url":"examples/eap-l2-worked-example/artifacts/eap-ctrl-010-evidence.json","artifact_type":"configuration","evidence_grade":"E3"}]},{"control_id":"EAP-CTRL-011","status":"pass","notes":"Synthetic auditor-access governance evidence.","evidence_artifacts":[{"artifact_id":"L2-EAP-CTRL-011-E1","description":"Reference evidence for EAP-CTRL-011 in the EAP-L2 worked example","path_or_url":"examples/eap-l2-worked-example/artifacts/eap-ctrl-011-evidence.json","artifact_type":"configuration","evidence_grade":"E3"}]},{"control_id":"EAP-CTRL-012","status":"pass","notes":"Synthetic retention-by-class policy evidence.","evidence_artifacts":[{"artifact_id":"L2-EAP-CTRL-012-E1","description":"Reference evidence for EAP-CTRL-012 in the EAP-L2 worked example","path_or_url":"examples/eap-l2-worked-example/artifacts/eap-ctrl-012-evidence.json","artifact_type":"configuration","evidence_grade":"E3"}]},{"control_id":"EAP-CTRL-013","status":"not_applicable","notes":"Not applicable at EAP-L2 according to the canonical overlay.","evidence_artifacts":[]},{"control_id":"EAP-CTRL-014","status":"pass","notes":"Quarterly bypass-test requirement is represented by an executable non-bypassability result in this worked example.","evidence_artifacts":[{"artifact_id":"L2-EAP-CTRL-014-E1","description":"Non-bypassability executable test result","path_or_url":"examples/eap-l2-worked-example/test-results/EAP-TEST-NB-001.json","artifact_type":"test_result","evidence_grade":"E4"}]},{"control_id":"EAP-CTRL-015","status":"pass","notes":"Synthetic reconstruction-drill completion evidence.","evidence_artifacts":[{"artifact_id":"L2-EAP-CTRL-015-E1","description":"Reference reconstruction-drill record","path_or_url":"examples/eap-l2-worked-example/artifacts/eap-ctrl-015-evidence.json","artifact_type":"test_result","evidence_grade":"E3"}]},{"control_id":"EAP-CTRL-016","status":"pass","notes":"Kill-switch behavior is exercised by EAP-TEST-KS-001.","evidence_artifacts":[{"artifact_id":"L2-EAP-CTRL-016-E1","description":"Kill-switch executable test result","path_or_url":"examples/eap-l2-worked-example/test-results/EAP-TEST-KS-001.json","artifact_type":"test_result","evidence_grade":"E4"}]},{"control_id":"EAP-CTRL-017","status":"pass","notes":"Synthetic accountable-role assignment evidence.","evidence_artifacts":[{"artifact_id":"L2-EAP-CTRL-017-E1","description":"Reference role-assignment evidence","path_or_url":"examples/eap-l2-worked-example/artifacts/eap-ctrl-017-evidence.json","artifact_type":"configuration","evidence_grade":"E3"}]},{"control_id":"EAP-CTRL-018","status":"pass","notes":"Synthetic separation-of-duties enforcement evidence.","evidence_artifacts":[{"artifact_id":"L2-EAP-CTRL-018-E1","description":"Reference SoD enforcement evidence","path_or_url":"examples/eap-l2-worked-example/artifacts/eap-ctrl-018-evidence.json","artifact_type":"configuration","evidence_grade":"E3"}]},{"control_id":"EAP-CTRL-019","status":"not_applicable","notes":"Not applicable at EAP-L2 according to the canonical overlay.","evidence_artifacts":[]},{"control_id":"EAP-CTRL-020","status":"pass","notes":"Synthetic vendor/integration dependency evidence.","evidence_artifacts":[{"artifact_id":"L2-EAP-CTRL-020-E1","description":"Reference dependency register evidence","path_or_url":"examples/eap-l2-worked-example/artifacts/eap-ctrl-020-evidence.json","artifact_type":"configuration","evidence_grade":"E3"}]}]}
